{
  "v": 1,
  "type": "auth.ok",
  "id": "01920000-0000-7000-8000-000000000108",
  "ts": "2026-10-09T04:36:00.000Z",
  "corr": "01920000-0000-7000-8000-000000000001",
  "payload": {
    "sessionId": "01920000-0000-7000-8000-000000000030",
    "resumeToken": "4444444444444444444444444444444444444444444444444444444444444444",
    "resumed": true,
    "configVersion": 0,
    "serverTime": "2026-10-09T04:36:00.000Z",
    "heartbeatIntervalMs": 5000,
    "control": {
      "mode": "paused",
      "scope": "store",
      "reason": "ownerRequest"
    },
    "needCapabilities": false
  }
}
