{
  "v": 1,
  "type": "auth.prove",
  "id": "01920000-0000-7000-8000-000000000106",
  "ts": "2026-10-09T04:36:00.000Z",
  "corr": "01920000-0000-7000-8000-000000000001",
  "payload": {
    "signature": "9f9f9f9f9f9f9f9f9f9f9f9f9f9f9f9f9f9f9f9f9f9f9f9f9f9f9f9f9f9f9f9f9f9f9f9f9f9f9f9f9f9f9f9f9f9f9f9f9f9f9f9f9f9f9f9f9f9f9f9f9f9f9f9f"
  }
}
