{
  "v": 1,
  "type": "capabilities",
  "id": "01920000-0000-7000-8000-000000000115",
  "ts": "2026-10-09T04:36:00.000Z",
  "payload": {
    "gpus": [
      {
        "index": 0,
        "name": "NVIDIA GeForce RTX 4060",
        "uuidHash": "5555555555555555555555555555555555555555555555555555555555555555",
        "vramTotalMb": 8188,
        "vramFreeMb": 7900,
        "driverVersion": "560.94",
        "computeCapability": "8.9"
      }
    ],
    "cpu": {
      "model": "Intel(R) Core(TM) i5-12400F",
      "cores": 6,
      "threads": 12
    },
    "ramMb": 16384,
    "cacheDiskFreeMb": 200000,
    "runtime": {
      "name": "llamacpp",
      "version": "b4567"
    },
    "cachedModels": [
      {
        "id": "qwen2.5-7b-instruct-q4_k_m",
        "sha256": "e1e1e1e1e1e1e1e1e1e1e1e1e1e1e1e1e1e1e1e1e1e1e1e1e1e1e1e1e1e1e1e1"
      }
    ],
    "osBuild": "10.0.22631.4317"
  }
}
