{
  "v": 1,
  "type": "hello",
  "id": "01920000-0000-7000-8000-000000000100",
  "ts": "2026-10-09T04:36:00.000Z",
  "payload": {
    "protocolHash": "abababababababababababababababababababababababababababababababab",
    "agentVersion": "0.1.0",
    "nodeId": "01920000-0000-7000-8000-000000000010",
    "capabilitiesDigest": "1111111111111111111111111111111111111111111111111111111111111111",
    "fpStore": "2222222222222222222222222222222222222222222222222222222222222222",
    "fpGlobal": "3333333333333333333333333333333333333333333333333333333333333333"
  }
}
